{"canonicalization":"wordpress-hx.canonical-json.v1","compileServer":{"compatibilityComponents":["compiler.genes","compiler.haxe","compiler.reflaxe-php","sdk.wordpress-hx","tool.lix"],"compatibilityDigest":"7eb9fb428b1fe091e75e0198cf5b79b07a702febae30fe10d5f2f983b3d07694","compatibilityDigestAlgorithm":"sha256-project-lock-config-compiler-inputs-and-build-env-v2","directBuildDefault":true,"policy":"project-isolated-compatible-attach-v1","restartFileRoles":["haxe-config","hxml","package-lock","package-manifest","project-config","project-lock"]},"discoveryRoots":[{"excludes":[".git/**",".wphx/runtime/**",".wphx/transactions/**","build/**","dist/**","node_modules/**"],"includes":[".haxerc","npm-lock.json","npm-manifest.json","wordpress-hx.json"],"path":".","targets":["assets","browser","metadata","php","plan","services"]},{"excludes":[],"includes":["**/*.hxml"],"path":".wphx/bootstrap","targets":["browser","metadata","php","plan"]},{"excludes":[],"includes":["**/*"],"path":"assets","targets":["assets"]},{"excludes":[],"includes":["**/*.hx","**/*.hxx"],"path":"src","targets":["browser","metadata","php","plan","services"]},{"excludes":[],"includes":["**/*.hx","**/*.hxx"],"path":"test","targets":["test"]}],"environment":{"build":[{"name":"SITE_LOCALE","source":"default","valueSha256":"674ac4b0bd40c5764a1ddf4e0119e9b4ee02f743211eefcf7b27c932a4831a4b"}],"runtimeExcluded":["WP_DB_PASSWORD"]},"files":[{"byteLength":52,"path":".haxerc","role":"haxe-config","sha256":"45071f8d2ff1adbc0e22b9b284983c63f77d28003aa8d351181a09c73888b191","targets":["browser","metadata","php","plan"]},{"byteLength":74,"path":".wphx/bootstrap/project.hxml","role":"hxml","sha256":"35a52a8f3d0ec33f5eb228d6d0010f82ebd991f71812f2bcdd2f85ddc6fc4f4d","targets":["browser","metadata","php","plan"]},{"byteLength":3329,"path":".wphx/project.lock.json","role":"project-lock","sha256":"b71260d6cee03dff576bc6d240410c16f372ff21eb4b3b01b6c84784ec400de1","targets":["assets","browser","metadata","php","plan","services","test"]},{"byteLength":29,"path":"assets/brand.txt","role":"asset","sha256":"a69a4f22ba6e51e0819d9540bfb2c181939eb013162893a96fef4f152b535857","targets":["assets"]},{"byteLength":524,"path":"npm-lock.json","role":"package-lock","sha256":"596a46a07a4ff7daea8a774c72429d34f7e9397584659b28a7d48c96ad63eac0","targets":["assets","browser","services"]},{"byteLength":332,"path":"npm-manifest.json","role":"package-manifest","sha256":"703ae6f08f6a758c01d946ea30b033a7e3e973a93754f82a03a1fb39b9e272b6","targets":["assets","browser","services"]},{"byteLength":857,"path":"src/acme/site/Site.hx","role":"haxe-source","sha256":"f573acf774fa9b2f6894dac036ba0b8a9cde76a5c2f1f6ac1e3a982296fad87c","targets":["browser","metadata","php","plan","services"]},{"byteLength":180,"path":"test/acme/site/SiteTest.hx","role":"haxe-source","sha256":"2cbf3b5a3c81a9645497b15d15a5058bb4cd97222e71dee542ba2d87e97b12cb","targets":["test"]},{"byteLength":1101,"path":"wordpress-hx.json","role":"project-config","sha256":"5cf302324ffb5618fe2410b5547d93a74326f3e5c0e812dc48afa5062470c36f","targets":["assets","browser","metadata","php","plan","services","test"]}],"fingerprint":"4c5f973f28fcff62b1065591e62a38d4246bd0ebd37dff431ef15d27fd1aa520","fingerprintAlgorithm":"sha256-canonical-json-without-fingerprint-v1","ignoredRoots":[".git",".wphx/runtime",".wphx/transactions","build","dist","node_modules"],"profile":{"catalogRevision":"wp70-release/catalog-v1","catalogSha256":"530a1581d07e7509fb68f7da5b53575009ed4a94280513efd82a8c99622d9d61","id":"wp70-release"},"project":{"configPath":"wordpress-hx.json","configSemanticSha256":"df18cceedf89682510cd191c6d8551e9b0401c30fc16c81852051ce11b7e8c6c","id":"acme-observatory","lockDigest":"4cfa2c74754de88a9e775a90c5103d14bcaa172eccdb90f639d790b6cab54e22","lockFileSha256":"b71260d6cee03dff576bc6d240410c16f372ff21eb4b3b01b6c84784ec400de1","lockPath":".wphx/project.lock.json"},"schema":"wordpress-hx.effective-inputs.v1","toolchain":[{"id":"compiler.genes","identity":"git:https://github.com/fullofcaffeine/genes-ts@122162abefc2035b307508e521348ea4fb36dab7#tree=739500b4f4f2513adc3d993cdab6e0e7620965a3","lockEntrySha256":"952dee138a021a2327c56c3b2bd6826b59405cf4267c6f2150096f11255aca46"},{"id":"compiler.haxe","identity":"git:https://github.com/HaxeFoundation/haxe@e0b355c6be312c1b17382603f018cf52522ec651#tree=55d2c4c59ed55c52fa0660e2fe385081a94b23d1","lockEntrySha256":"1ed760bf676bedec6c5158629cb161836bb3494d05b775ae306871a7ae8fd99e"},{"id":"compiler.reflaxe-php","identity":"sdk:wordpress-hx@0.0.0/compiler/reflaxe.php#sha256=cf0fc152f4fe09b8a9eb92f6b9f4c1f1591ab938531d6241c245ab11a75532f6","lockEntrySha256":"2f8a00a5c6ae96c79b123aa3f62ef5473618781cb64e890f46141735a0c2a6ce"},{"id":"runtime.node","identity":"docker.io/library/node@sha256:b04ce4ae4e95b522112c2e5c52f781471a5cbc3b594527bcddedee9bc48c03a0","lockEntrySha256":"7f6c0b82e1346b0d9144d4059bb98ae53fbbfc55abf1f5b5660bcec732386e3c"},{"id":"sdk.wordpress-hx","identity":"repository:wordpresshx@fixture#toolchain-lock-sha256=f76230a6e27154d9ffc467362a0a75c51b633a6aa59bf696df6ab5f15e872785","lockEntrySha256":"e1282e744617c516716bb7161b63e71b36a28734157276dc6074cc87867820a8"},{"id":"tool.lix","identity":"npm:lix@15.12.4#sha256=4f2257276aba9f552b1b35237d33fbc1a0898039d8105ed6e8d1468e6c53a2fa","lockEntrySha256":"5794a3ba0fc4e14c0b6a21c1d05d92445dd50db1666bde3594b739322c20834e"},{"id":"tool.npm","identity":"docker.io/library/node@sha256:b04ce4ae4e95b522112c2e5c52f781471a5cbc3b594527bcddedee9bc48c03a0#npm=10.9.2","lockEntrySha256":"0f5d1e5711092eb6919e32a4bc71ff2f1ee4dcba6ee81547dc0c6c9fb4daeea3"},{"id":"tool.wordpress-scripts","identity":"npm:@wordpress/scripts@31.5.0#integrity=sha512-7OS5bpHtnuagG8k9q9BdilHjhQ0MLhY0ypDgnRom5WlgPBshM/SUaF9bQLDnSDeasiD/bIgaDmoxWkfVZ4qSPQ==","lockEntrySha256":"494bb8c59c6964b30b244f6640bdcd5ac8cdf9060130af811604de9c3561c958"}],"watchRoots":[".",".wphx/bootstrap","assets","src","test"]}
